{
  "schema_version": "1.0",
  "sender": {
    "value": "Fiktive Kontrollstelle West",
    "evidence": [
      {
        "page": 1,
        "quote": "Fiktive Kontrollstelle West",
        "verification": "matched"
      }
    ]
  },
  "document_date": {
    "value": "2026-10-27",
    "evidence": [
      {
        "page": 1,
        "quote": "Datum: 27.10.2026",
        "verification": "matched"
      }
    ]
  },
  "letter_type": {
    "value": "Testmitteilung",
    "evidence": [
      {
        "page": 1,
        "quote": "Betreff: Testmitteilung",
        "verification": "matched"
      }
    ]
  },
  "summary": {
    "value": "Bitte erlaeutern Sie die Buchung TEST-82.",
    "evidence": [
      {
        "page": 1,
        "quote": "Bitte erlaeutern Sie die Buchung TEST-82.",
        "verification": "matched"
      }
    ]
  },
  "recipients": [
    {
      "name": {
        "value": "Musterwerk Linde GmbH",
        "evidence": [
          {
            "page": 1,
            "quote": "An: Musterwerk Linde GmbH",
            "verification": "matched"
          }
        ]
      },
      "address": {
        "value": "Testweg 12, 00001 Musterstadt",
        "evidence": [
          {
            "page": 1,
            "quote": "Anschrift: Testweg 12, 00001 Musterstadt",
            "verification": "matched"
          }
        ]
      },
      "identifiers": [
        {
          "type": "de_tax_id",
          "value": "00000000123",
          "jurisdiction": null,
          "authority": null,
          "other_type": null,
          "holder_role": "addressee",
          "evidence": [
            {
              "page": 1,
              "quote": "Steuer-ID des Adressaten: 00000000123",
              "verification": "matched"
            }
          ]
        }
      ]
    }
  ],
  "other_identifiers": [],
  "readability": "readable",
  "action_assessment": "actions_found",
  "actions": [
    {
      "title": "Bitte erlaeutern Sie die Buchung TEST-82.",
      "description": "Bitte erlaeutern Sie die Buchung TEST-82.",
      "evidence": [
        {
          "page": 1,
          "quote": "Bitte erlaeutern Sie die Buchung TEST-82.",
          "verification": "matched"
        }
      ],
      "deadline": {
        "kind": "not_found",
        "date": null,
        "wording": null,
        "anchor": null,
        "evidence": []
      }
    }
  ],
  "warnings": []
}
