{
  "schema_version": "1.0",
  "sender": {
    "value": "Fiktive Kontrollstelle West",
    "evidence": [
      {
        "page": 1,
        "quote": "Fiktive Kontrollstelle West",
        "verification": "matched"
      }
    ]
  },
  "document_date": {
    "value": "2026-10-27",
    "evidence": [
      {
        "page": 1,
        "quote": "Datum: 27.10.2026",
        "verification": "matched"
      }
    ]
  },
  "letter_type": {
    "value": "Testmitteilung",
    "evidence": [
      {
        "page": 1,
        "quote": "Betreff: Testmitteilung",
        "verification": "matched"
      }
    ]
  },
  "summary": {
    "value": "Bitte reichen Sie den Kassenbericht bis zum 19.11.2026 ein.",
    "evidence": [
      {
        "page": 1,
        "quote": "Bitte reichen Sie den Kassenbericht bis zum 19.11.2026 ein.",
        "verification": "matched"
      }
    ]
  },
  "recipients": [
    {
      "name": {
        "value": "Musterwerk Linde GmbH",
        "evidence": [
          {
            "page": 1,
            "quote": "An: Musterwerk Linde GmbH",
            "verification": "matched"
          }
        ]
      },
      "address": {
        "value": "Testweg 12, 00001 Musterstadt",
        "evidence": [
          {
            "page": 1,
            "quote": "Anschrift: Testweg 12, 00001 Musterstadt",
            "verification": "matched"
          }
        ]
      },
      "identifiers": [
        {
          "type": "de_tax_id",
          "value": "00000000123",
          "jurisdiction": null,
          "authority": null,
          "other_type": null,
          "holder_role": "addressee",
          "evidence": [
            {
              "page": 1,
              "quote": "Steuer-ID des Adressaten: 00000000123",
              "verification": "matched"
            }
          ]
        }
      ]
    }
  ],
  "other_identifiers": [
    {
      "type": "de_tax_id",
      "value": "00000000456",
      "jurisdiction": null,
      "authority": null,
      "other_type": null,
      "holder_role": "sender",
      "evidence": [
        {
          "page": 1,
          "quote": "Steuer-ID des Absenders: 00000000456",
          "verification": "matched"
        }
      ]
    }
  ],
  "readability": "readable",
  "action_assessment": "actions_found",
  "actions": [
    {
      "title": "Bitte reichen Sie den Kassenbericht bis zum 19.11.2026 ein.",
      "description": "Bitte reichen Sie den Kassenbericht bis zum 19.11.2026 ein.",
      "evidence": [
        {
          "page": 1,
          "quote": "Bitte reichen Sie den Kassenbericht bis zum 19.11.2026 ein.",
          "verification": "matched"
        }
      ],
      "deadline": {
        "kind": "explicit_date",
        "date": "2026-11-19",
        "wording": "bis zum 19.11.2026",
        "anchor": null,
        "evidence": [
          {
            "page": 1,
            "quote": "bis zum 19.11.2026",
            "verification": "matched"
          }
        ]
      }
    }
  ],
  "warnings": []
}
