{
  "schema_version": "1.0",
  "sender": {
    "value": "Fiktive Prüfstelle Musterbezirk 09",
    "evidence": [
      {
        "page": 1,
        "quote": "Fiktive Prüfstelle Musterbezirk 09",
        "verification": "matched"
      }
    ]
  },
  "document_date": {
    "value": "2026-10-25",
    "evidence": [
      {
        "page": 1,
        "quote": "Datum: 25.10.2026",
        "verification": "matched"
      }
    ]
  },
  "letter_type": {
    "value": "Musteranfrage",
    "evidence": [
      {
        "page": 1,
        "quote": "Betreff: Musteranfrage",
        "verification": "matched"
      }
    ]
  },
  "summary": {
    "value": "Zwei getrennte Arbeitsschritte zur Musterprüfung 1",
    "evidence": [
      {
        "page": 1,
        "quote": "Prüfen Sie die fiktive Beleggruppe 1 auf fehlende Zuordnungen.",
        "verification": "matched"
      }
    ]
  },
  "recipients": [
    {
      "name": {
        "value": "Beispielbetrieb Alpha GmbH",
        "evidence": [
          {
            "page": 1,
            "quote": "An: Beispielbetrieb Alpha GmbH",
            "verification": "matched"
          }
        ]
      },
      "address": {
        "value": "Musterweg 7, 00000 Beispielstadt",
        "evidence": [
          {
            "page": 1,
            "quote": "Anschrift: Musterweg 7, 00000 Beispielstadt",
            "verification": "matched"
          }
        ]
      },
      "identifiers": [
        {
          "type": "other",
          "value": "SYN-0007",
          "jurisdiction": "SYNTHETIC",
          "authority": "Fiktive Beispielstelle",
          "other_type": "synthetic_client_reference",
          "holder_role": "addressee",
          "evidence": [
            {
              "page": 1,
              "quote": "Mandantenreferenz: SYN-0007",
              "verification": "matched"
            }
          ]
        }
      ]
    }
  ],
  "other_identifiers": [],
  "readability": "readable",
  "action_assessment": "actions_found",
  "actions": [
    {
      "title": "Beleggruppe 1 prüfen",
      "description": "Prüfen Sie die fiktive Beleggruppe 1 auf fehlende Zuordnungen.",
      "evidence": [
        {
          "page": 1,
          "quote": "Prüfen Sie die fiktive Beleggruppe 1 auf fehlende Zuordnungen.",
          "verification": "matched"
        }
      ],
      "deadline": {
        "kind": "explicit_date",
        "date": "2026-12-02",
        "wording": "Spätester Eingang: 02.12.2026.",
        "anchor": null,
        "evidence": [
          {
            "page": 1,
            "quote": "Spätester Eingang: 02.12.2026.",
            "verification": "matched"
          }
        ]
      }
    },
    {
      "title": "Rückmeldung 1 senden",
      "description": "Senden Sie anschließend eine getrennte Rückmeldung zur Musterprüfung 1.",
      "evidence": [
        {
          "page": 1,
          "quote": "Senden Sie anschließend eine getrennte Rückmeldung zur Musterprüfung 1.",
          "verification": "matched"
        }
      ],
      "deadline": {
        "kind": "explicit_date",
        "date": "2026-12-12",
        "wording": "Spätester Eingang: 12.12.2026.",
        "anchor": null,
        "evidence": [
          {
            "page": 1,
            "quote": "Spätester Eingang: 12.12.2026.",
            "verification": "matched"
          }
        ]
      }
    }
  ],
  "warnings": []
}
