{
  "schema_version": "1.0",
  "sender": {
    "value": "Fiktiver Eigenbetrieb Abwasser Testbucht",
    "evidence": [
      {
        "page": 1,
        "quote": "Fiktiver Eigenbetrieb Abwasser Testbucht",
        "verification": "matched"
      }
    ]
  },
  "document_date": {
    "value": "2026-10-27",
    "evidence": [
      {
        "page": 1,
        "quote": "Ausfertigung: 27.10.2026",
        "verification": "matched"
      }
    ]
  },
  "letter_type": {
    "value": "Prüfung Schmutzwasserabzug",
    "evidence": [
      {
        "page": 1,
        "quote": "Vorgang: Prüfung Schmutzwasserabzug",
        "verification": "matched"
      }
    ]
  },
  "summary": {
    "value": "Bitte senden Sie das Foto des Zwischenzählers mit lesbarem Zählerstand bis zum 18.11.2026.",
    "evidence": [
      {
        "page": 1,
        "quote": "Bitte senden Sie das Foto des Zwischenzählers mit lesbarem Zählerstand bis zum 18.11.2026.",
        "verification": "matched"
      }
    ]
  },
  "recipients": [
    {
      "name": {
        "value": "Küstenrad Reparatur eG",
        "evidence": [
          {
            "page": 1,
            "quote": "Empfänger: Küstenrad Reparatur eG",
            "verification": "matched"
          }
        ]
      },
      "address": {
        "value": "Speichenhof 8, 00044 Testbucht",
        "evidence": [
          {
            "page": 1,
            "quote": "Zustellanschrift: Speichenhof 8, 00044 Testbucht",
            "verification": "matched"
          }
        ]
      },
      "identifiers": [
        {
          "type": "other",
          "value": "BG-KR-734",
          "jurisdiction": "TEST-KÜSTE",
          "authority": "Fiktiver Gewerbeverband Küste",
          "other_type": "Betriebskennzeichen",
          "holder_role": "addressee",
          "evidence": [
            {
              "page": 1,
              "quote": "Betriebskennzeichen des Empfängers: BG-KR-734",
              "verification": "matched"
            }
          ]
        }
      ]
    }
  ],
  "other_identifiers": [],
  "readability": "readable",
  "action_assessment": "actions_found",
  "actions": [
    {
      "title": "Zwischenzähler fotografisch nachweisen",
      "description": "Bitte senden Sie das Foto des Zwischenzählers mit lesbarem Zählerstand bis zum 18.11.2026.",
      "evidence": [
        {
          "page": 1,
          "quote": "Bitte senden Sie das Foto des Zwischenzählers mit lesbarem Zählerstand bis zum 18.11.2026.",
          "verification": "matched"
        }
      ],
      "deadline": {
        "kind": "explicit_date",
        "date": "2026-11-18",
        "wording": "Bitte senden Sie das Foto des Zwischenzählers mit lesbarem Zählerstand bis zum 18.11.2026.",
        "anchor": null,
        "evidence": [
          {
            "page": 1,
            "quote": "Bitte senden Sie das Foto des Zwischenzählers mit lesbarem Zählerstand bis zum 18.11.2026.",
            "verification": "matched"
          }
        ]
      }
    }
  ],
  "warnings": []
}
