{
  "schema_version": "1.0",
  "sender": {
    "value": "Fiktive Rechtsanwaltskammer Musterau",
    "evidence": [
      {
        "page": 1,
        "quote": "Fiktive Rechtsanwaltskammer Musterau",
        "verification": "matched"
      }
    ]
  },
  "document_date": {
    "value": "2026-10-27",
    "evidence": [
      {
        "page": 1,
        "quote": "Ausfertigung: 27.10.2026",
        "verification": "matched"
      }
    ]
  },
  "letter_type": {
    "value": "Pflege des beruflichen Verzeichnisses",
    "evidence": [
      {
        "page": 1,
        "quote": "Vorgang: Pflege des beruflichen Verzeichnisses",
        "verification": "matched"
      }
    ]
  },
  "summary": {
    "value": "Bitte teilen Sie die neue berufliche Zustellanschrift bis zum 20.11.2026 mit.",
    "evidence": [
      {
        "page": 1,
        "quote": "Bitte teilen Sie die neue berufliche Zustellanschrift bis zum 20.11.2026 mit.",
        "verification": "matched"
      }
    ]
  },
  "recipients": [
    {
      "name": {
        "value": "Nele Winter",
        "evidence": [
          {
            "page": 1,
            "quote": "Empfänger: Nele Winter",
            "verification": "matched"
          }
        ]
      },
      "address": {
        "value": "Heidebogen 22, 00043 Musterau",
        "evidence": [
          {
            "page": 1,
            "quote": "Zustellanschrift: Heidebogen 22, 00043 Musterau",
            "verification": "matched"
          }
        ]
      },
      "identifiers": [
        {
          "type": "de_tax_id",
          "value": "00000000733",
          "jurisdiction": null,
          "authority": null,
          "other_type": null,
          "holder_role": "addressee",
          "evidence": [
            {
              "page": 1,
              "quote": "Steuer-ID des Empfängers: 00000000733",
              "verification": "matched"
            }
          ]
        }
      ]
    }
  ],
  "other_identifiers": [],
  "readability": "readable",
  "action_assessment": "actions_found",
  "actions": [
    {
      "title": "Berufliche Zustellanschrift mitteilen",
      "description": "Bitte teilen Sie die neue berufliche Zustellanschrift bis zum 20.11.2026 mit.",
      "evidence": [
        {
          "page": 1,
          "quote": "Bitte teilen Sie die neue berufliche Zustellanschrift bis zum 20.11.2026 mit.",
          "verification": "matched"
        }
      ],
      "deadline": {
        "kind": "explicit_date",
        "date": "2026-11-20",
        "wording": "Bitte teilen Sie die neue berufliche Zustellanschrift bis zum 20.11.2026 mit.",
        "anchor": null,
        "evidence": [
          {
            "page": 1,
            "quote": "Bitte teilen Sie die neue berufliche Zustellanschrift bis zum 20.11.2026 mit.",
            "verification": "matched"
          }
        ]
      }
    }
  ],
  "warnings": []
}
