{
  "schema_version": "1.0",
  "sender": {
    "value": "Fiktive Prüfstelle Musterbezirk 06",
    "evidence": [
      {
        "page": 1,
        "quote": "Fiktive Prüfstelle Musterbezirk 06",
        "verification": "matched"
      }
    ]
  },
  "document_date": {
    "value": "2026-10-25",
    "evidence": [
      {
        "page": 1,
        "quote": "Datum: 25.10.2026",
        "verification": "matched"
      }
    ]
  },
  "letter_type": {
    "value": "Musteranfrage",
    "evidence": [
      {
        "page": 1,
        "quote": "Betreff: Musteranfrage",
        "verification": "matched"
      }
    ]
  },
  "summary": {
    "value": "Registerauszug senden",
    "evidence": [
      {
        "page": 1,
        "quote": "Senden Sie einen aktuellen synthetischen Registerauszug.",
        "verification": "matched"
      }
    ]
  },
  "recipients": [
    {
      "name": {
        "value": "Beispielbetrieb Gamma GmbH",
        "evidence": [
          {
            "page": 1,
            "quote": "An: Beispielbetrieb Gamma GmbH",
            "verification": "matched"
          }
        ]
      },
      "address": {
        "value": "Musterweg 9, 00000 Beispielstadt",
        "evidence": [
          {
            "page": 1,
            "quote": "Anschrift: Musterweg 9, 00000 Beispielstadt",
            "verification": "matched"
          }
        ]
      },
      "identifiers": [
        {
          "type": "other",
          "value": "SYN-0009",
          "jurisdiction": "SYNTHETIC",
          "authority": "Fiktive Beispielstelle",
          "other_type": "synthetic_client_reference",
          "holder_role": "addressee",
          "evidence": [
            {
              "page": 1,
              "quote": "Mandantenreferenz: SYN-0009",
              "verification": "matched"
            }
          ]
        }
      ]
    }
  ],
  "other_identifiers": [],
  "readability": "readable",
  "action_assessment": "actions_found",
  "actions": [
    {
      "title": "Registerauszug senden",
      "description": "Senden Sie einen aktuellen synthetischen Registerauszug.",
      "evidence": [
        {
          "page": 1,
          "quote": "Senden Sie einen aktuellen synthetischen Registerauszug.",
          "verification": "matched"
        }
      ],
      "deadline": {
        "kind": "explicit_date",
        "date": "2026-12-16",
        "wording": "Spätester Eingang: 16.12.2026.",
        "anchor": null,
        "evidence": [
          {
            "page": 1,
            "quote": "Spätester Eingang: 16.12.2026.",
            "verification": "matched"
          }
        ]
      }
    }
  ],
  "warnings": []
}
