{
  "schema_version": "1.0",
  "sender": {
    "value": "Fiktive Prüfstelle Musterbezirk 14",
    "evidence": [
      {
        "page": 1,
        "quote": "Fiktive Prüfstelle Musterbezirk 14",
        "verification": "matched"
      }
    ]
  },
  "document_date": {
    "value": "2026-10-25",
    "evidence": [
      {
        "page": 1,
        "quote": "Datum: 25.10.2026",
        "verification": "matched"
      }
    ]
  },
  "letter_type": {
    "value": "Demonstrationsauftrag",
    "evidence": [
      {
        "page": 1,
        "quote": "Betreff: Demonstrationsauftrag",
        "verification": "matched"
      }
    ]
  },
  "summary": {
    "value": "Relativer Termin mit ausdrücklich genanntem Bezug 2",
    "evidence": [
      {
        "page": 1,
        "quote": "Ergänzen Sie die fehlenden Musterunterlagen der Gruppe R2.",
        "verification": "matched"
      }
    ]
  },
  "recipients": [
    {
      "name": {
        "value": "Beispielbetrieb Alpha GmbH",
        "evidence": [
          {
            "page": 1,
            "quote": "An: Beispielbetrieb Alpha GmbH",
            "verification": "matched"
          }
        ]
      },
      "address": {
        "value": "Musterweg 7, 00000 Beispielstadt",
        "evidence": [
          {
            "page": 1,
            "quote": "Anschrift: Musterweg 7, 00000 Beispielstadt",
            "verification": "matched"
          }
        ]
      },
      "identifiers": [
        {
          "type": "other",
          "value": "SYN-0007",
          "jurisdiction": "SYNTHETIC",
          "authority": "Fiktive Beispielstelle",
          "other_type": "synthetic_client_reference",
          "holder_role": "addressee",
          "evidence": [
            {
              "page": 1,
              "quote": "Mandantenreferenz: SYN-0007",
              "verification": "matched"
            }
          ]
        }
      ]
    }
  ],
  "other_identifiers": [],
  "readability": "readable",
  "action_assessment": "actions_found",
  "actions": [
    {
      "title": "Musterunterlagen ergänzen",
      "description": "Ergänzen Sie die fehlenden Musterunterlagen der Gruppe R2.",
      "evidence": [
        {
          "page": 1,
          "quote": "Ergänzen Sie die fehlenden Musterunterlagen der Gruppe R2.",
          "verification": "matched"
        }
      ],
      "deadline": {
        "kind": "relative",
        "date": null,
        "wording": "Die Ergänzung ist innerhalb von zwei Wochen nach der fiktiven Besprechung einzureichen.",
        "anchor": "fiktive Besprechung",
        "evidence": [
          {
            "page": 1,
            "quote": "Die Ergänzung ist innerhalb von zwei Wochen nach der fiktiven Besprechung einzureichen.",
            "verification": "matched"
          }
        ]
      }
    }
  ],
  "warnings": []
}
